<?xml version="1.0" encoding="UTF-8"?>
<sinopia_maps xmlns="https://uwlib-cams.github.io/sinopia_maps/"
    xmlns:xsi="http://www.w3.org/2001/XMLSchema-instance"
    xsi:schemaLocation="https://uwlib-cams.github.io/sinopia_maps/ 
    https://uwlib-cams.github.io/sinopia_maps/sinopia_maps.xsd">
    <rts>
        <rt>
            <propSet>rdacManifestation</propSet>
            <resource>rdacManifestation</resource>
            <format>test_literal_props</format>
            <user>ries07</user>
            <author>Benjamin Riesenberg / ries07@uw.edu</author>
        </rt>
        <rt>
            <propSet>rdacManifestation</propSet>
            <resource>rdacManifestation</resource>
            <format>test_uri_or_lookup_props</format>
            <user>ries07</user>
            <author>Benjamin Riesenberg / ries07@uw.edu</author>
        </rt>
        <rt>
            <propSet>rdacManifestation</propSet>
            <resource>rdacManifestation</resource>
            <format>test_nested_resource_props</format>
            <user>ries07</user>
            <author>Benjamin Riesenberg / ries07@uw.edu</author>
        </rt>
    </rts>
</sinopia_maps>
