<?xml version="1.0" encoding="UTF-8"?>
<sinopia_maps xmlns="https://uwlib-cams.github.io/sinopia_maps/xsd/"
    xmlns:xsi="http://www.w3.org/2001/XMLSchema-instance"
    xsi:schemaLocation="https://uwlib-cams.github.io/sinopia_maps/xsd/ https://uwlib-cams.github.io/sinopia_maps/xsd/sinopia_maps.xsd">
    <rts>
        <!-- WEMI TEMPLATES -->
        <rt>
            <institution>WAU</institution>
            <resource>rdaWork</resource>
            <format>printMonograph</format>
            <user>CAMS</user>
            <author>UW CAMS - ries07@uw.edu</author>
        </rt>
		<rt>
            <institution>WAU</institution>
            <resource>rdaExpression</resource>
		    <format>printMonograph</format>
            <user>CAMS</user>
		    <author>UW CAMS - ries07@uw.edu</author>
        </rt>
        <rt>
            <institution>WAU</institution>
            <resource>rdaManifestation</resource>
            <format>printMonograph</format>
            <user>CAMS</user>
            <author>UW CAMS - ries07@uw.edu</author>
        </rt>
        <rt>
            <institution>WAU</institution>
            <resource>rdaItem</resource>
            <format>printMonograph</format>
            <user>CAMS</user>
            <author>UW CAMS - ries07@uw.edu</author>
        </rt>
        
        <rt>
            <institution>WAU</institution>
            <resource>rdaWork</resource>
            <format>metadata_nested</format>
            <user>CAMS</user>
            <author>UW CAMS - ries07@uw.edu</author>
        </rt>
        
        <!-- AGENT TEMPLATES -->
        <rt>
            <institution>WAU</institution>
            <resource>rdaAgent</resource>
            <format>nested</format>
            <user>CAMS</user>
            <author>UW CAMS - ries07@uw.edu</author>
        </rt>
        
       <!-- NOMEN TEMPLATES -->        
        <rt>
            <institution>WAU</institution>
            <resource>rdaNomen</resource>
            <format>nested</format>
            <user>CAMS</user>
            <author>UW CAMS - mcm104@uw.edu</author>
        </rt>
        
        <!-- PLACE TEMPLATES -->
        <rt>
            <institution>WAU</institution>
            <resource>rdaPlace</resource>
            <format>nested</format>
            <user>CAMS</user>
            <author>UW CAMS - ries07@uw.edu</author>
        </rt>
        
        <!-- TIMESPAN TEMPLATES -->
        <rt>
            <institution>WAU</institution>
            <resource>rdaTimespan</resource>
            <format>nested</format>
            <user>CAMS</user>
            <author>UW CAMS - ries07@uw.edu</author>
        </rt>
        
        <!-- TEST TEMPLATES -->
        
        <rt>
            <institution>WAU</institution>
            <resource>rdaPlace</resource>
            <format>test</format>
            <user>cspayne</user>
            <author>Cypress Payne - cspayne@uw.edu</author>
        </rt>
        <rt>
            <institution>WAU</institution>
            <resource>rdaWork</resource>
            <format>test</format>
            <user>cspayne</user>
            <author>Cypress Payne - cspayne@uw.edu</author>
        </rt>
        
        <!-- ...future templates -->
        <!--
        <rt>
            <institution>WAU</institution>
            <resource>rdaCollectiveAgent</resource>
            <format>nested</format>
            <user>CAMS</user>
            <author>UW CAMS - ries07@uw.edu</author>
        </rt>
        <rt>
            <institution>WAU</institution>
            <resource>rdaPerson</resource>
            <format>nested</format>
            <user>CAMS</user>
            <author>UW CAMS - ries07@uw.edu</author>
        </rt>
        <rt>
            <institution>WAU</institution>
            <resource>rdaCorporateBody</resource>
            <format>nested</format>
            <user>CAMS</user>
            <author>UW CAMS - ries07@uw.edu</author>
        </rt>
        <rt>
            <institution>WAU</institution>
            <resource>rdaFamily</resource>
            <format>nested</format>
            <user>CAMS</user>
            <author>UW CAMS - ries07@uw.edu</author>
        </rt>
         -->
    </rts>
</sinopia_maps>
